{
  "$schema": "https://json-schema.org/draft/2020-12/schema",
  "title": "narrative",
  "type": "object",
  "properties": {
    "document_info": {
      "type": "object",
      "properties": {
        "document_type": {
          "type": [
            "string",
            "null"
          ]
        },
        "date": {
          "type": [
            "string",
            "null"
          ]
        },
        "prepared_by": {
          "type": [
            "string",
            "null"
          ]
        },
        "recipient": {
          "type": [
            "string",
            "null"
          ]
        }
      },
      "required": [
        "document_type",
        "date",
        "prepared_by",
        "recipient"
      ],
      "additionalProperties": false
    },
    "insured": {
      "type": "object",
      "properties": {
        "name": {
          "type": [
            "string",
            "null"
          ]
        },
        "address": {
          "type": [
            "string",
            "null"
          ]
        },
        "city": {
          "type": [
            "string",
            "null"
          ]
        },
        "state": {
          "type": [
            "string",
            "null"
          ],
          "enum": [
            "AL",
            "AK",
            "AZ",
            "AR",
            "CA",
            "CO",
            "CT",
            "DE",
            "FL",
            "GA",
            "HI",
            "ID",
            "IL",
            "IN",
            "IA",
            "KS",
            "KY",
            "LA",
            "ME",
            "MD",
            "MA",
            "MI",
            "MN",
            "MS",
            "MO",
            "MT",
            "NE",
            "NV",
            "NH",
            "NJ",
            "NM",
            "NY",
            "NC",
            "ND",
            "OH",
            "OK",
            "OR",
            "PA",
            "RI",
            "SC",
            "SD",
            "TN",
            "TX",
            "UT",
            "VT",
            "VA",
            "WA",
            "WV",
            "WI",
            "WY",
            "DC",
            "PR",
            "GU",
            "VI",
            "AS",
            "MP",
            null
          ]
        },
        "zip": {
          "type": [
            "string",
            "null"
          ]
        }
      },
      "required": [
        "name",
        "address",
        "city",
        "state",
        "zip"
      ],
      "additionalProperties": false
    },
    "business_description": {
      "type": "object",
      "properties": {
        "nature_of_business": {
          "type": [
            "string",
            "null"
          ]
        },
        "sic_code": {
          "type": [
            "string",
            "null"
          ]
        },
        "naics_code": {
          "type": [
            "string",
            "null"
          ]
        },
        "years_in_business": {
          "type": [
            "integer",
            "null"
          ]
        },
        "annual_revenue": {
          "type": [
            "number",
            "null"
          ]
        },
        "employee_count": {
          "type": [
            "integer",
            "null"
          ]
        }
      },
      "required": [
        "nature_of_business",
        "sic_code",
        "naics_code",
        "years_in_business",
        "annual_revenue",
        "employee_count"
      ],
      "additionalProperties": false
    },
    "coverages_discussed": {
      "type": "array",
      "items": {
        "type": "object",
        "properties": {
          "coverage_type": {
            "type": [
              "string",
              "null"
            ]
          },
          "current_limit": {
            "type": [
              "string",
              "null"
            ]
          },
          "requested_limit": {
            "type": [
              "string",
              "null"
            ]
          },
          "current_carrier": {
            "type": [
              "string",
              "null"
            ]
          },
          "expiring_premium": {
            "type": [
              "number",
              "null"
            ]
          },
          "notes": {
            "type": [
              "string",
              "null"
            ]
          }
        },
        "required": [
          "coverage_type",
          "current_limit",
          "requested_limit",
          "current_carrier",
          "expiring_premium",
          "notes"
        ],
        "additionalProperties": false
      }
    },
    "risk_highlights": {
      "type": "object",
      "properties": {
        "positives": {
          "type": "array",
          "items": {
            "type": "string"
          }
        },
        "concerns": {
          "type": "array",
          "items": {
            "type": "string"
          }
        },
        "loss_history_summary": {
          "type": [
            "string",
            "null"
          ]
        }
      },
      "required": [
        "positives",
        "concerns",
        "loss_history_summary"
      ],
      "additionalProperties": false
    },
    "locations_summary": {
      "type": "object",
      "properties": {
        "location_count": {
          "type": [
            "integer",
            "null"
          ]
        },
        "states_of_operation": {
          "type": "array",
          "items": {
            "type": "string",
            "enum": [
              "AL",
              "AK",
              "AZ",
              "AR",
              "CA",
              "CO",
              "CT",
              "DE",
              "FL",
              "GA",
              "HI",
              "ID",
              "IL",
              "IN",
              "IA",
              "KS",
              "KY",
              "LA",
              "ME",
              "MD",
              "MA",
              "MI",
              "MN",
              "MS",
              "MO",
              "MT",
              "NE",
              "NV",
              "NH",
              "NJ",
              "NM",
              "NY",
              "NC",
              "ND",
              "OH",
              "OK",
              "OR",
              "PA",
              "RI",
              "SC",
              "SD",
              "TN",
              "TX",
              "UT",
              "VT",
              "VA",
              "WA",
              "WV",
              "WI",
              "WY",
              "DC",
              "PR",
              "GU",
              "VI",
              "AS",
              "MP"
            ]
          }
        },
        "total_insured_value": {
          "type": [
            "number",
            "null"
          ]
        }
      },
      "required": [
        "location_count",
        "states_of_operation",
        "total_insured_value"
      ],
      "additionalProperties": false
    },
    "fleet_summary": {
      "type": "object",
      "properties": {
        "vehicle_count": {
          "type": [
            "integer",
            "null"
          ]
        },
        "driver_count": {
          "type": [
            "integer",
            "null"
          ]
        },
        "radius_of_operation": {
          "type": [
            "string",
            "null"
          ]
        }
      },
      "required": [
        "vehicle_count",
        "driver_count",
        "radius_of_operation"
      ],
      "additionalProperties": false
    },
    "key_dates": {
      "type": "object",
      "properties": {
        "current_policy_effective": {
          "type": [
            "string",
            "null"
          ]
        },
        "current_policy_expiration": {
          "type": [
            "string",
            "null"
          ]
        },
        "requested_effective": {
          "type": [
            "string",
            "null"
          ]
        }
      },
      "required": [
        "current_policy_effective",
        "current_policy_expiration",
        "requested_effective"
      ],
      "additionalProperties": false
    },
    "extracted_text_sections": {
      "type": "object",
      "properties": {
        "executive_summary": {
          "type": [
            "string",
            "null"
          ]
        },
        "operations_description": {
          "type": [
            "string",
            "null"
          ]
        },
        "safety_programs": {
          "type": [
            "string",
            "null"
          ]
        },
        "claims_narrative": {
          "type": [
            "string",
            "null"
          ]
        }
      },
      "required": [
        "executive_summary",
        "operations_description",
        "safety_programs",
        "claims_narrative"
      ],
      "additionalProperties": false
    }
  },
  "required": [
    "document_info",
    "insured",
    "business_description",
    "coverages_discussed",
    "risk_highlights",
    "locations_summary",
    "fleet_summary",
    "key_dates",
    "extracted_text_sections"
  ],
  "additionalProperties": false
}
