{
  "document_info": {
    "document_type": "Carrier History",
    "date": null,
    "prepared_by": null,
    "recipient": null
  },
  "insured": {
    "name": null,
    "address": null,
    "city": null,
    "state": null,
    "zip": null
  },
  "business_description": {
    "nature_of_business": null,
    "sic_code": null,
    "naics_code": null,
    "years_in_business": null,
    "annual_revenue": null,
    "employee_count": null
  },
  "coverages_discussed": [
    {
      "coverage_type": "Prior Insurance History",
      "current_limit": null,
      "requested_limit": null,
      "current_carrier": "CNA Financial",
      "expiring_premium": 414601.77,
      "notes": "Year: 2024; Policy Number: CP-5690-6189; Claims: 1; Loss Ratio: ; Cancellation: No"
    },
    {
      "coverage_type": "Prior Insurance History",
      "current_limit": null,
      "requested_limit": null,
      "current_carrier": "Zurich Insurance Group",
      "expiring_premium": 423914.72,
      "notes": "Year: 2023; Policy Number: 7CP0006249; Claims: 0; Loss Ratio: ; Cancellation: No"
    },
    {
      "coverage_type": "Prior Insurance History",
      "current_limit": null,
      "requested_limit": null,
      "current_carrier": "American International Group",
      "expiring_premium": 447842.42,
      "notes": "Year: 2022; Policy Number: CP006315-001; Claims: 1; Loss Ratio: ; Cancellation: No"
    },
    {
      "coverage_type": "Prior Insurance History",
      "current_limit": null,
      "requested_limit": null,
      "current_carrier": "Auto-Owners Insurance",
      "expiring_premium": 470199.5,
      "notes": "Year: 2021; Policy Number: 0000006024; Claims: 0; Loss Ratio: ; Cancellation: No"
    },
    {
      "coverage_type": "Prior Insurance History",
      "current_limit": null,
      "requested_limit": null,
      "current_carrier": "Berkshire Hathaway Guard",
      "expiring_premium": 467047.27,
      "notes": "Year: 2020; Policy Number: 7CP0004214; Claims: 1; Loss Ratio: ; Cancellation: No"
    }
  ],
  "risk_highlights": {
    "positives": [
      "No cancellations reported across 2020-2024",
      "Low reported claim count in each year provided"
    ],
    "concerns": [
      "Claims reported in 2020, 2022, and 2024"
    ],
    "loss_history_summary": "Prior insurance history shows 1 claim in 2024, 0 in 2023, 1 in 2022, 0 in 2021, and 1 in 2020. No cancellations were reported."
  },
  "locations_summary": {
    "location_count": null,
    "states_of_operation": [],
    "total_insured_value": null
  },
  "fleet_summary": {
    "vehicle_count": null,
    "driver_count": null,
    "radius_of_operation": null
  },
  "key_dates": {
    "current_policy_effective": null,
    "current_policy_expiration": null,
    "requested_effective": null
  },
  "extracted_text_sections": {
    "executive_summary": "Prior Insurance History\n2024 CNA Financial CP-5690-6189 Premium 414601.77 Claims 1 Cancellation No\n2023 Zurich Insurance Group 7CP0006249 Premium 423914.72 Claims 0 Cancellation No\n2022 American International Group CP006315-001 Premium 447842.42 Claims 1 Cancellation No\n2021 Auto-Owners Insurance 0000006024 Premium 470199.5 Claims 0 Cancellation No\n2020 Berkshire Hathaway Guard 7CP0004214 Premium 467047.27 Claims 1 Cancellation No",
    "operations_description": null,
    "safety_programs": null,
    "claims_narrative": "2024: 1 claim; 2023: 0 claims; 2022: 1 claim; 2021: 0 claims; 2020: 1 claim. No cancellations reported in any year provided."
  }
}