{
  "document_info": {
    "document_type": "Excel Submission Data",
    "date": null,
    "prepared_by": null,
    "recipient": null
  },
  "insured": {
    "name": "Keystone Commercial Builders, Inc.",
    "address": "300 Liberty Avenue, Suite 1200",
    "city": "Pittsburgh",
    "state": "PA",
    "zip": "15222"
  },
  "business_description": {
    "nature_of_business": "Commercial Builders / Construction",
    "sic_code": null,
    "naics_code": null,
    "years_in_business": null,
    "annual_revenue": 95000000,
    "employee_count": null
  },
  "coverages_discussed": [
    {
      "coverage_type": "Multiple Lines / Package",
      "current_limit": null,
      "requested_limit": null,
      "current_carrier": "Nationwide Insurance",
      "expiring_premium": 1634721.63,
      "notes": "2024 expiring premium and carrier based on Insurance History schedule. Coverage includes WC, GL, Auto, and Property."
    }
  ],
  "risk_highlights": {
    "positives": [],
    "concerns": [],
    "loss_history_summary": "Loss summary indicates 52 total claims across WC (35), GL (8), Auto (8), and Property (1), with total incurred losses of $1,489,697. WC is the primary driver with $1,176,100 incurred."
  },
  "locations_summary": {
    "location_count": 5,
    "states_of_operation": [
      "PA"
    ],
    "total_insured_value": 39405000
  },
  "fleet_summary": {
    "vehicle_count": null,
    "driver_count": 15,
    "radius_of_operation": null
  },
  "key_dates": {
    "current_policy_effective": null,
    "current_policy_expiration": null,
    "requested_effective": null
  },
  "extracted_text_sections": {
    "executive_summary": null,
    "operations_description": null,
    "safety_programs": null,
    "claims_narrative": null
  }
}