{
  "document_info": {
    "document_type": "Broker narrative / Transfer Submission",
    "date": "2025-06-18",
    "prepared_by": "David Reinhardt, Vice President, Transportation Insurance Specialists",
    "recipient": "Underwriting Department, Standard Insurance Company"
  },
  "insured": {
    "name": "Great Lakes Freight Systems, Inc.",
    "address": "9810 Nationwide Boulevard",
    "city": "Columbus",
    "state": "OH",
    "zip": "43215"
  },
  "business_description": {
    "nature_of_business": "Regional trucking and freight logistics providing LTL and FTL general freight, warehousing, and distribution services across the Midwest and Mid-Atlantic corridor.",
    "sic_code": null,
    "naics_code": null,
    "years_in_business": 38,
    "annual_revenue": null,
    "employee_count": 485
  },
  "coverages_discussed": [
    {
      "coverage_type": "Workers' Compensation",
      "current_limit": null,
      "requested_limit": "Statutory; Employer's Liability 1000000/1000000/1000000",
      "current_carrier": "OH basic state fund",
      "expiring_premium": null,
      "notes": "Coverage provided through OH basic state fund workers' compensation per state statute."
    },
    {
      "coverage_type": "General Liability",
      "current_limit": null,
      "requested_limit": "2000000 per occurrence / 4000000 aggregate",
      "current_carrier": null,
      "expiring_premium": null,
      "notes": "Occurrence form including standard premises/operations and products/completed operations."
    },
    {
      "coverage_type": "Commercial Auto",
      "current_limit": null,
      "requested_limit": "5000000 combined single limit",
      "current_carrier": null,
      "expiring_premium": null,
      "notes": "Business Auto covering all owned, hired, and non-owned vehicles."
    },
    {
      "coverage_type": "Commercial Property",
      "current_limit": null,
      "requested_limit": null,
      "current_carrier": null,
      "expiring_premium": null,
      "notes": "Coverage for all scheduled locations on a special form with replacement cost valuation."
    },
    {
      "coverage_type": "Umbrella / Excess",
      "current_limit": null,
      "requested_limit": "10000000 occurrence / 10000000 aggregate",
      "current_carrier": null,
      "expiring_premium": null,
      "notes": "Following form over primary GL, Auto, and Employer's Liability."
    },
    {
      "coverage_type": "Motor Truck Cargo",
      "current_limit": null,
      "requested_limit": null,
      "current_carrier": null,
      "expiring_premium": null,
      "notes": "Coverage as per expiring program."
    }
  ],
  "risk_highlights": {
    "positives": [
      "Formal business continuity and disaster recovery plan tested annually.",
      "Dedicated safety committee meets monthly and conducts quarterly site audits.",
      "Employee assistance program and workplace wellness initiative have been in place for over five years.",
      "Contractual risk transfer provisions are included in all subcontractor and vendor agreements.",
      "Third-party risk control survey completed within the past 12 months with favorable results.",
      "Formal return-to-work program reduced lost-time claims by over 30%.",
      "All locations have security cameras, sprinklers, and 24/7 monitoring services.",
      "Structured HR program with consistent safety training for 485 employees.",
      "Fleet of 37 vehicles is maintained under a documented preventive maintenance schedule."
    ],
    "concerns": [
      "Loss experience reflects a mixed trend with some large individual claims in the review period.",
      "10 claims remain open."
    ],
    "loss_history_summary": "Loss experience reflects a mixed trend with some large individual claims in the review period. Over the review period, the insured incurred 48 total claims with 1378733.13 total paid losses and 1503069.19 total incurred. Currently, 10 claims remain open and 38 have been closed. Average loss ratio is 12.9%. Breakdown by coverage line: Workers' Compensation 24 claims, 826622.56 paid, 888785.06 incurred; General Liability 5 claims, 54126.51 paid, 54126.51 incurred; Commercial Auto 16 claims, 387376.46 paid, 449550.02 incurred; Commercial Property 2 claims, 106691.36 paid, 106691.36 incurred; Umbrella / Excess 0 claims, 0.00 paid, 0.00 incurred; Motor Truck Cargo 1 claim, 3916.24 paid, 3916.24 incurred."
  },
  "locations_summary": {
    "location_count": null,
    "states_of_operation": [
      "OH"
    ],
    "total_insured_value": null
  },
  "fleet_summary": {
    "vehicle_count": 37,
    "driver_count": null,
    "radius_of_operation": "Midwest and Mid-Atlantic corridor"
  },
  "key_dates": {
    "current_policy_effective": null,
    "current_policy_expiration": null,
    "requested_effective": null
  },
  "extracted_text_sections": {
    "executive_summary": "We are pleased to submit Great Lakes Freight Systems, Inc. for your review and consideration. The insured is a regional trucking and freight logistics - LTL and FTL general freight, warehousing and distribution services across the Midwest and Mid-Atlantic corridor, headquartered in Columbus, with approximately 38 years of operating history. Coverage is requested for Workers' Compensation, General Liability, Commercial Auto, Commercial Property, Umbrella / Excess, Motor Truck Cargo.",
    "operations_description": "The insured is a regional trucking and freight logistics - LTL and FTL general freight, warehousing and distribution services across the Midwest and Mid-Atlantic corridor, headquartered in Columbus, with approximately 38 years of operating history.",
    "safety_programs": "The insured maintains a formal business continuity and disaster recovery plan tested annually; maintains a dedicated safety committee that meets monthly and conducts quarterly site audits; has had an employee assistance program and workplace wellness initiative in place for over five years; carries contractual risk transfer provisions in all subcontractor and vendor agreements; completed a third-party risk control survey within the past 12 months with favorable results; implemented a formal return-to-work program that has reduced lost-time claims by over 30%; equips all locations with security cameras, sprinklers, and 24/7 monitoring services; and maintains its fleet of 37 vehicles under a documented preventive maintenance schedule.",
    "claims_narrative": "The loss experience reflects a mixed trend with some large individual claims in the review period. Over the review period, the insured incurred 48 total claims with 1378733.13 in total paid losses and 1503069.19 total incurred. Currently, 10 claims remain open and 38 have been closed. Average loss ratio is 12.9%. Breakdown by coverage line: Workers' Compensation 24 claims, 826622.56 paid, 888785.06 incurred; General Liability 5 claims, 54126.51 paid, 54126.51 incurred; Commercial Auto 16 claims, 387376.46 paid, 449550.02 incurred; Commercial Property 2 claims, 106691.36 paid, 106691.36 incurred; Umbrella / Excess 0 claims, 0.00 paid, 0.00 incurred; Motor Truck Cargo 1 claim, 3916.24 paid, 3916.24 incurred."
  }
}