{
  "document_info": {
    "document_type": "Policy Form",
    "date": null,
    "prepared_by": "Texas Commercial Insurance Partners",
    "recipient": "Lone Star Property Holdings, LP"
  },
  "insured": {
    "name": "Lone Star Property Holdings, LP",
    "address": "2200 Ross Avenue, Suite 4500",
    "city": "Dallas",
    "state": "TX",
    "zip": "75201"
  },
  "business_description": {
    "nature_of_business": "Commercial real estate investment and property management \u2014 office, retail, and mixed-use properties across the Dallas-Fort Worth and Houston metropolitan areas",
    "sic_code": "6512",
    "naics_code": null,
    "years_in_business": null,
    "annual_revenue": null,
    "employee_count": null
  },
  "coverages_discussed": [
    {
      "coverage_type": "Commercial Property",
      "current_limit": 314984000,
      "requested_limit": null,
      "current_carrier": "Apex Managing General Agency",
      "expiring_premium": null,
      "notes": "Bound premium: 403697.14. Building Limit: 222340000. Contents Limit: 33432000. Business Income Limit: 59212000. Deductible: 50000."
    }
  ],
  "risk_highlights": {
    "positives": [],
    "concerns": [],
    "loss_history_summary": null
  },
  "locations_summary": {
    "location_count": null,
    "states_of_operation": [
      "TX"
    ],
    "total_insured_value": 314984000
  },
  "fleet_summary": {
    "vehicle_count": null,
    "driver_count": null,
    "radius_of_operation": null
  },
  "key_dates": {
    "current_policy_effective": "2025-07-01",
    "current_policy_expiration": "2026-07-01",
    "requested_effective": null
  },
  "extracted_text_sections": {
    "executive_summary": null,
    "operations_description": "Commercial real estate investment and property management \u2014 office, retail, and mixed-use properties across the Dallas-Fort Worth and Houston metropolitan areas",
    "safety_programs": null,
    "claims_narrative": null
  }
}